{
  "$id": "audience-clips.v1/review-input.schema.json",
  "title": "ReviewInput",
  "$schema": "https://json-schema.org/draft/2020-12/schema",
  "type": "object",
  "properties": {
    "schemaVersion": {
      "type": "string",
      "const": "audience-clips.v1"
    },
    "research": {
      "type": "object",
      "properties": {
        "schemaVersion": {
          "type": "string",
          "const": "audience-clips.v1"
        },
        "runId": {
          "type": "string",
          "minLength": 1
        },
        "mode": {
          "type": "string",
          "enum": [
            "live",
            "fixture"
          ]
        },
        "video": {
          "type": "object",
          "properties": {
            "url": {
              "type": "string",
              "format": "uri"
            },
            "videoId": {
              "type": "string",
              "minLength": 1
            },
            "channelId": {
              "type": "string",
              "minLength": 1
            },
            "title": {
              "type": "string"
            }
          },
          "required": [
            "url",
            "videoId",
            "channelId",
            "title"
          ]
        },
        "creatorGoal": {
          "type": [
            "string",
            "null"
          ]
        },
        "researchStatus": {
          "type": "string",
          "enum": [
            "ready",
            "insufficient_evidence"
          ]
        },
        "coverage": {
          "type": "object",
          "properties": {
            "fetchedAt": {
              "type": "string",
              "pattern": "^\\d{4}-\\d{2}-\\d{2}T\\d{2}:\\d{2}:\\d{2}(\\.\\d{1,9})?Z$"
            },
            "videoIds": {
              "type": "array",
              "items": {
                "type": "string",
                "minLength": 1
              }
            },
            "commentCount": {
              "type": "integer",
              "minimum": 0,
              "maximum": 9007199254740991
            },
            "samplingMethod": {
              "type": "string"
            },
            "limitations": {
              "type": "array",
              "items": {
                "type": "string"
              }
            }
          },
          "required": [
            "fetchedAt",
            "videoIds",
            "commentCount",
            "samplingMethod",
            "limitations"
          ]
        },
        "evidence": {
          "type": "array",
          "items": {
            "type": "object",
            "properties": {
              "id": {
                "type": "string",
                "minLength": 1
              },
              "commentId": {
                "type": "string",
                "minLength": 1
              },
              "videoId": {
                "type": "string",
                "minLength": 1
              },
              "url": {
                "type": "string",
                "format": "uri"
              },
              "quote": {
                "type": "string"
              },
              "publishedAt": {
                "type": "string",
                "pattern": "^\\d{4}-\\d{2}-\\d{2}T\\d{2}:\\d{2}:\\d{2}(\\.\\d{1,9})?Z$"
              }
            },
            "required": [
              "id",
              "commentId",
              "videoId",
              "url",
              "quote",
              "publishedAt"
            ]
          }
        },
        "questions": {
          "type": "array",
          "items": {
            "type": "object",
            "properties": {
              "id": {
                "type": "string",
                "minLength": 1
              },
              "question": {
                "type": "string",
                "minLength": 1
              },
              "kind": {
                "type": "string",
                "enum": [
                  "explicit",
                  "inferred"
                ]
              },
              "evidenceIds": {
                "type": "array",
                "items": {
                  "type": "string",
                  "minLength": 1
                }
              },
              "observedCommentCount": {
                "type": "integer",
                "minimum": 0,
                "maximum": 9007199254740991
              },
              "priority": {
                "type": "number"
              },
              "rationale": {
                "type": "string"
              }
            },
            "required": [
              "id",
              "question",
              "kind",
              "evidenceIds",
              "observedCommentCount",
              "priority",
              "rationale"
            ]
          }
        },
        "generationBrief": {
          "anyOf": [
            {
              "type": "object",
              "properties": {
                "targetQuestionIds": {
                  "type": "array",
                  "items": {
                    "type": "string",
                    "minLength": 1
                  }
                },
                "customPrompt": {
                  "type": "string"
                },
                "durationSec": {
                  "type": "array",
                  "prefixItems": [
                    {
                      "type": "number",
                      "minimum": 0
                    },
                    {
                      "type": "number",
                      "minimum": 0
                    }
                  ],
                  "items": false,
                  "minItems": 2,
                  "maxItems": 2
                },
                "aspectRatio": {
                  "type": "string",
                  "enum": [
                    "portrait",
                    "landscape",
                    "square"
                  ]
                }
              },
              "required": [
                "targetQuestionIds",
                "customPrompt",
                "durationSec",
                "aspectRatio"
              ]
            },
            {
              "type": "null"
            }
          ]
        }
      },
      "required": [
        "schemaVersion",
        "runId",
        "mode",
        "video",
        "creatorGoal",
        "researchStatus",
        "coverage",
        "evidence",
        "questions",
        "generationBrief"
      ]
    },
    "generation": {
      "type": "object",
      "properties": {
        "provider": {
          "type": "string",
          "const": "opusclip"
        },
        "projectId": {
          "type": "string",
          "minLength": 1
        },
        "requestedQuestionIds": {
          "type": "array",
          "items": {
            "type": "string",
            "minLength": 1
          }
        },
        "submittedPrompt": {
          "type": "string"
        },
        "completedAt": {
          "type": "string",
          "pattern": "^\\d{4}-\\d{2}-\\d{2}T\\d{2}:\\d{2}:\\d{2}(\\.\\d{1,9})?Z$"
        }
      },
      "required": [
        "provider",
        "projectId",
        "requestedQuestionIds",
        "submittedPrompt",
        "completedAt"
      ]
    },
    "sourceTranscript": {
      "type": "object",
      "properties": {
        "coverage": {
          "type": "string",
          "enum": [
            "full",
            "partial",
            "unavailable"
          ]
        },
        "segments": {
          "type": "array",
          "items": {
            "type": "object",
            "properties": {
              "id": {
                "type": "string",
                "minLength": 1
              },
              "startMs": {
                "type": "integer",
                "minimum": 0,
                "maximum": 9007199254740991
              },
              "endMs": {
                "type": "integer",
                "minimum": 0,
                "maximum": 9007199254740991
              },
              "text": {
                "type": "string"
              }
            },
            "required": [
              "id",
              "startMs",
              "endMs",
              "text"
            ]
          }
        },
        "limitations": {
          "type": "array",
          "items": {
            "type": "string"
          }
        }
      },
      "required": [
        "coverage",
        "segments",
        "limitations"
      ]
    },
    "clips": {
      "type": "array",
      "items": {
        "type": "object",
        "properties": {
          "id": {
            "type": "string",
            "minLength": 1
          },
          "title": {
            "type": "string"
          },
          "previewUrl": {
            "anyOf": [
              {
                "type": "string",
                "format": "uri"
              },
              {
                "type": "null"
              }
            ]
          },
          "exportUrl": {
            "anyOf": [
              {
                "type": "string",
                "format": "uri"
              },
              {
                "type": "null"
              }
            ]
          },
          "sourceRanges": {
            "type": "array",
            "items": {
              "type": "object",
              "properties": {
                "startMs": {
                  "type": "integer",
                  "minimum": 0,
                  "maximum": 9007199254740991
                },
                "endMs": {
                  "type": "integer",
                  "minimum": 0,
                  "maximum": 9007199254740991
                }
              },
              "required": [
                "startMs",
                "endMs"
              ]
            }
          },
          "transcriptStatus": {
            "type": "string",
            "enum": [
              "available",
              "unavailable"
            ]
          },
          "transcript": {
            "type": "array",
            "items": {
              "type": "object",
              "properties": {
                "id": {
                  "type": "string",
                  "minLength": 1
                },
                "sourceStartMs": {
                  "type": "integer",
                  "minimum": 0,
                  "maximum": 9007199254740991
                },
                "sourceEndMs": {
                  "type": "integer",
                  "minimum": 0,
                  "maximum": 9007199254740991
                },
                "text": {
                  "type": "string"
                }
              },
              "required": [
                "id",
                "sourceStartMs",
                "sourceEndMs",
                "text"
              ]
            }
          }
        },
        "required": [
          "id",
          "title",
          "previewUrl",
          "exportUrl",
          "sourceRanges",
          "transcriptStatus",
          "transcript"
        ]
      }
    },
    "limitations": {
      "type": "array",
      "items": {
        "type": "string"
      }
    }
  },
  "required": [
    "schemaVersion",
    "research",
    "generation",
    "sourceTranscript",
    "clips",
    "limitations"
  ]
}
